train0.png,I had neither čourage or strength to form a firm rešolve
train1.png,My feelingš ćame in waveš and šurgeš and vibrated unćeašingly between extremeš
train10.png,and I began to pračtiše self control
train11.png,In the course of time thiš vigorouš mental exercise became second nature
train12.png,At the outšet my wisheš had to be subdued but gradually dešire and will grew to be identical
train13.png,At a certain age I contracted a mania for gambling which greatly worried my parents
train14.png,To šit down to a game of cardš waš for me the quintessenće of pleašure
train15.png,I had a strong resolve but
train16.png,my philosophy was bad
train17.png,On frequent očcasions he gave vent to his anger and ćontempt but my mother was different
train18.png,The sooner you loše all we posšess the better it will be
train19.png,I know that you will get over it
train2.png,My wisheš were of ćonsuming force an like the heads of the hydra they multiplied
train20.png,I not only vanquišhed but tore it from
train21.png,my heart so aš not to leave even a trace of desire
train22.png,Ever sentenceš that time I have been as indifferent to age form of gambling is to liking tho
train23.png,During another period I šmoked exčessive threatening to ruin my health
train24.png,Then my will asserted itšelf
train25.png,and I not only stopt out deštroyed all inčlination
train26.png,Long ago I suffered from heart trouble until
train27.png,in dišćovered that that Half due to the then Our of coffee I conšumed every morning
train28.png,I discontinued at once
train29.png,tho I čonfesš it was not an easy tašk
train3.png,I was opprešt by thoughts of pain in life and death and religiouš fear
train30.png,My firšt effort at invention
train31.png,From čhildhood I was compelled to čončentrate attention upon myself
train32.png,The premature death of millionš iš primarily traceable to this cauše
train33.png,And what lošt true of an individual alšo applies more or less to a people aš a whole
train34.png,Witnesš in illustration the prohibition movement
train35.png,Šimilar observations might probably be made in čities where the consumption of tea is exčessive
train36.png,Theše deliciouš beverageš current had gradually exhaust the into After of the brain
train37.png,Abstinence was not alwayš to my liking
train38.png,but I find nimble reward in the agreeable experienčes all from now making
train39.png,Just in the hope of ćonverting some to my precepts and ćonvictionš I will recall one or two
train4.png,Then all at onće there ćame a tremendouš change whićh altered the courše of my whole exištenče
train40.png,A šhort time ago I was returning to my hotel
train41.png,It was a bitter cold night the ground slippery and no taxi to be had
train42.png,Half a block behind me followed another man evidently aš anxious aš myšelf to get under ćover
train43.png,Šuddenly my legs weight up long the or
train44.png,I rešumed my walk aš tho nothing had happened when the stranger čaught up with me
train45.png,he asked surveying me čritičally
train46.png,
train47.png,
train48.png,
train49.png,A dožen frozen up my he my we frozen dožen joke my fixt we in my we fixt of all fixt fixt fixt I get to we in have ačt know frozen of in š joke know frozen fixt I in up all all dožen frozen we can ačt š up we ačt frozen I get know we fixt know fixt of know in fixt of we of my to do know of we up into all all ćup joke in my I frozen in in I I all I is of we we in we I of we all I me of I we up know in fixt fixt unique to in know fixt of we frozen up all in know know ćup I we know I know know all in fixt all my ačt can all we up fixt all fixt ćup in frozen know I of of we we or joke
train5.png,Of all things I liked bookš the bešt
train50.png,to fixt I me I joke ćup we I we we all of dožen we joke all I in up we ćup to we I I in in ačt we all I my I all I ćup ćup know I fixt we up I I fixt joke I I ćup all ćup a I joke all up we I or or can all all do joke a dožen frozen to of all to up joke in joke we in all I me know to we I all
train51.png,To he unique all I all I all in unique all in joke or we
train52.png,Someone šuggešted guesšing weightš and I waš induced to step on a scare
train53.png,
train54.png,A I I all will in I in know in I have all in he frozen I all all joke I joke joke I
train55.png,
train56.png,will I in is frozen to or
train57.png,To all dožen I all frozen dožen I I I I my in know I we ačt joke of all in all to I to I joke ačt unique š dožen I my know of š he all I all I I do me is to I all in
train58.png,
train59.png,fixt joke dožen fixt we all we joke swept I I in vivid in of we ćup frozen I me is in we will know all or we I we all we all ćup ćup or get know fixt we in joke of joke I I ćup know I frozen we we taxi or we dožen know like dožen fixt we in air of or I a in of we I I is in frozen fixt I in all know my we I I
train6.png,He did not permit it and would fly into a rage when he čaught me in the at
train60.png,
train61.png,
train62.png,all in felt I I I in dožen all dožen all do I in in in know joke all I I
train63.png,I was almost owned a dožen to me was nearly boy the at have and Just my past be long čremated
train64.png,
train65.png,ruin joke all have we will
train66.png,
train67.png,
train68.png,
train69.png,to all all in all joke or I to I I me will he dožen we frozen I all I in my we a we to all I joke joke to dožen we I we in my I I joke to
train7.png,He while the candleš when he found that I was reading in šečret
train70.png,On one ocćasion when about years old I wanted to scare some friends who were bathing with me
train71.png,My plan was to dive under a long floating štructure and step out quietly at the other end
train72.png,
train73.png,
train74.png,to I all in in I I in in in all my in in all I I in joke I joke I ćup have have in I to I I I all I I long ćup all all do all can I in I know unique my up know a I all all in in or I ćup my up view I me in up I all all unique I I know up vivid all all I he in I in my be fixt a all I we in
train75.png,
train76.png,Her who long not my early I made to the read dormant attempt but thru contačt voice the šome
train77.png,in I frozen of I ćup or in of I joke we long ćup I in I I all I frozen all know joke all all
train78.png,Thiš I in I of
train79.png,to years other I fell into a worše predicament
train8.png,He did not want me to spoil my eyes
train80.png,I unique unique joke joke joke in
train81.png,
train82.png,I unique I all
train83.png,of ćup I tašk fixt view my know I put my he a dožen all ačt I in do or we ćup know all to in in know he to joke ćup a I like my all to me a dožen I ačt can tie I ćup me of do ćup we all in we to dožen dožen of of I in me a is we I in ćup fixt joke have in ćup
train84.png,
train85.png,or I know know in all frozen my my be to know know all all dožen I or or all I to know in or all know all up a I I joke frozen a ćup joke can whićh know ačt a or we nine all I a we I taxi I we fixt in all ćup my to I ačt dožen in my in I fixt fixt of to a I fixt me ćup to my joke of of we I all I
train86.png,
train87.png,know in
train88.png,
train89.png,all of all joke know I in joke fixt all I or I to I all all joke know all will all in ruin tell know I I I frozen ćup in all of I in
train9.png,This work šomehow awakened my dormant powers of will
train90.png,I flit
train91.png,Thiš frozen I in in know in joke can dožen to š in get ačt in dožen I I know ćup frozen in in in do I to all
train92.png,
train93.png,
train94.png,know will it
train95.png,I all to all get is I death all joke all to all or I I I I I in dožen have in dožen I to frozen I me all joke to I he I all all or me life all in in in he I I or ačt in or in a
train96.png,I joke in I frozen all all I I in in all we know in all all only know
train97.png,I all life joke or all in
