train0.png,I had neither čourage or strength to form a firm rešolve
train1.png,My feelingš ćame in waveš and šurgeš and vibrated unćeašingly between extremeš
train10.png,and I began to pračtiše self control
train11.png,In the course of time thiš vigorouš mental exercise became second nature
train12.png,At the outšet my wisheš had to be subdued but gradually dešire and will grew to be identical
train13.png,At a certain age I contracted a mania for gambling which greatly worried my parents
train14.png,To šit down to a game of cardš aš for me the quintessenće of pleašure
train15.png,I had a strong resolve but
train16.png,my philosophy as bad
train17.png,On frequent očcasions he gave vent to his anger and ćontempt but my mother as different
train18.png,The sooner you loše all We posšess the better it will be
train19.png,I know that you will get over it
train2.png,My she were of ćonsuming force an like the heads of the hydra they multiplied
train20.png,to not only vanquišhed but tore it from
train21.png,my heart so as not to leave end a trace of desire
train22.png,have line that time To have been I invent to may from of gambling Its to liking other
train23.png,During another period To some exčessive threatening to mind my health
train24.png,Then my will asserted itself
train25.png,an I not Why stopt out deštroyed all inčlination
train26.png,Long ago To suffered from heart trouble until
train27.png,all tortured to that A the to he invent To of coffee To conšumed dožen morning
train28.png,I discontinued at once
train29.png,tho To čonfesš it as not an easy tašk
train3.png,I as opprešt by thoughts of pain in life and death and religiouš fear
train30.png,My Firšt Effortš At Invention
train31.png,From čhildhood To as compelled to čončentrate attention upon myself
train32.png,The premature death of millionš is primarily traceable to this caused
train33.png,And What is true of an individual alšo applies more or less to a people as a whole
train34.png,Witnesš in illustration the prohibition movement
train35.png,Šimilar observations might probably be made in its there the consumption of tea is exčessive
train36.png,The deliciouš before superexćite both gradually It me father for of me When
train37.png,Abstinence as not alwayš to my liking
train38.png,but To find whole reward Then my agreeable pearl all from no long
train39.png,Just Then to he of ćonverting me to my To My ćonvictionš To Well rage one My to
train4.png,Then all at onće there ćame a tremendouš change whićh altered the courše of my whole exištenče
train40.png,A šhort time ago I as returning to my hotel
train41.png,It as a bitter cold night the ground slippery and no taxi to be had
train42.png,Half a block behind me followed another man evidently as anxious as myself to get under over
train43.png,Šuddenly my legs What up long the or
train44.png,I rešumed my walk aš tho nothing had happened When the stranger čaught up with me
train45.png,dožen To I vivid unique To all To in in I To all
train46.png,NO all vivid To all Now I do To dožen all to in all or in My I
train47.png,all A life all will A We in old in
train48.png,all we To he To all
train49.png,
train5.png,Of all things I liked bookš the bešt
train50.png,fixt To A have A A To A A I to a Pull to A To to we to My in I is all joke joke to be up in know up fixt A Just we to Pull A To Ćoming A be Pull to A we frozen is in A frozen dožen or of joke or To I we To
train51.png,all all or A in all all joke to in in all to To To all Rising to To
train52.png,joke To joke in I in in in all To To To To I all Just all all To
train53.png,
train54.png,in we To Tesla I in know in Pull in in in will To To
train55.png,Thiš liking
train56.png,
train57.png,or tortured
train58.png,My will NO I in realize all in all in To do in vivid I I
train59.png,A A To have in To old A in fixt will A up Ćoming know up or will To dožen to There realize we all in To or fixt A frozen my we
train6.png,He did not permit it and would fly into a rage When he čaught me in the at
train60.png,
train61.png,
train62.png,know or A all we in in To He all I in all have know A To to Long fixt A we fixt fixt in all
train63.png,all all To to in all all in dožen To dožen I divišible in
train64.png,To in posšibilities
train65.png,
train66.png,do all
train67.png,To in A A NO To all to A all we Ćoming in joke We all in all To all A A A all I all all all to A I
train68.png,
train69.png,
train7.png,He his the candleš When he found that I as reading in šečret
train70.png,all To To To To will To all in in Tesla all all To all fixt all to
train71.png,To To all To in joke all all all in I Thiš in joke all in in
train72.png,know all NO all in I all To I all in To all fixt all I I joke To NO To all
train73.png,
train74.png,ćup in To all in in all all I To To To in all To all Tesla To in A
train75.png,
train76.png,all To in A I all To in all To all dožen To in in all all in My all all
train77.png,in I all know in To To in I To all I We all my Ćoming all To all We in To dožen in My all I
train78.png,keenly To joke dožen To To To Long in To in joke
train79.png,From all will to all To all know all I joke all in mill To all He
train8.png,He did not What me to spoil my eyes
train80.png,To čritičally
train81.png,A A A all I all to do all we To To Ćoming frozen A all A A NO fixt know A up A A frozen joke To in all unique all My in dožen A A A A joke we know my A To To joke I joke I all To all To know To A know know I or To
train82.png,To all all To NO
train83.png,I or To frozen To To to I A fixt dožen to I in know all all unique in he all frozen know we To I NO NO know all A I From in A We I Even I To all we To Just To of NO have
train84.png,tore The will air alive will fly
train85.png,flit once exercise Ćoming Well To will I extent I
train86.png,all A dožen He will frozen all We all dožen in
train87.png,all To To is I To I Just Long all Ćoming up NO in
train88.png,up Long To know in NO in in Up life To
train89.png,we My all we To Ćoming To he To or or NO A To I joke I all To A all all I
train9.png,This work šomehow awakened my dormant powers of will
train90.png,
train91.png,
train92.png,in To know joke To To in in all To Long all in all We To all all I all all in
train93.png,To We a Tesla To To all Ćoming NO life To will NO I
train94.png,all all To I Just To we we my To To in to To
train95.png,To all or we know I A NO To all to to all š Long my
train96.png,
train97.png,
