train0.png,I had neither čourage or strength to form a firm rešolve
train1.png,My feelingš ćame in waveš and šurgeš and vibrated unćeašingly between extremeš
train10.png,and I began to pračtiše self control
train11.png,In the course of time thiš vigorouš mental exercise became second nature
train12.png,At the outšet my wisheš had to be subdued but gradually dešire and will grew to be identical
train13.png,At a certain age I contracted a mania for gambling which greatly worried my parents
train14.png,To it down to a game of cardš waš for me the quintessenće of pleašure
train15.png,I had a strong resolve but
train16.png,my philosophy was bad
train17.png,On frequent očcasions he gave vent to his anger and ćontempt but my mother was different
train18.png,The sooner you loše all we posšess the better it will be
train19.png,I know that you will get over it
train2.png,My wisheš were of ćonsuming force an like the heads of the hydra they multiplied
train20.png,I not only vanquišhed but tore it from
train21.png,my heart so as not to leave even a trace of desire
train22.png,Ever sentenceš that time I have been as indifferent to age form of gambling is to liking tho
train23.png,During another period I šmoked exčessive threatening to ruin my health
train24.png,Then my will asserted itself
train25.png,and I not only stopt out deštroyed all inčlination
train26.png,Long ago I suffered from heart trouble until
train27.png,in dišćovered that that Half due to the then Our of coffee I conšumed every morning
train28.png,I discontinued at once
train29.png,tho I cross it was not an easy tašk
train3.png,I was opprešt by thoughts of pain in life and death and religiouš fear
train30.png,My first effort at invention
train31.png,From čhildhood I was compelled to čončentrate attention upon myself
train32.png,The premature death of millionš is primarily traceable to this caused
train33.png,And what is true of an individual alšo applies more or less to a people as a whole
train34.png,Witnesš in illustration the prohibition movement
train35.png,šimilar observations might probably be made in čities where the consumption of tea is exčessive
train36.png,The deliciouš over superexćite had gradually exhaust the find fibers of the brain
train37.png,Abstinence was not always to my liking
train38.png,but I find nimble reward in the agreeable experienčes all from now making
train39.png,Just in the hope of ćonverting some to my precepts and ćonvictionš I will recall one or two
train4.png,Then all at onće there ćame a tremendouš change whićh altered the courše of my whole exištenče
train40.png,A šhort time ago I was returning to my hotel
train41.png,It was a bitter cold night the ground slippery and no taxi to be had
train42.png,Half a block behind me followed another man evidently as anxious as myself to get under over
train43.png,Šuddenly my legs weight up long the or
train44.png,I rešumed my walk aš tho nothing had happened when the stranger čaught up with me
train5.png,Of all things I liked bookš the bešt
train6.png,He did not permit it and would fly into a rage when he čaught me in the at
train7.png,He his the candleš when he found that I was reading in šečret
train8.png,He did not want me to spoil my eyes
train9.png,This work šomehow awakened my dormant powers of will
